{
  "version": 1,
  "operationMode": "production-package",
  "ingredient": {
    "type": "SUPPLEMENT",
    "name": "Jarrow Formulas B-Right B族维生素复合胶囊",
    "brand": "Jarrow Formulas",
    "productModel": "B-Right Optimized B-Complex, 100 veggie capsules",
    "notes": "演练用补剂草稿。英文品名为 Jarrow Formulas B-Right Optimized B-Complex。标签来自用户提供的 iHerb 商品截图和瓶身 Supplement Facts 图片；正式入库前建议复核产品批次和当前销售页面标签是否一致。",
    "tagIds": []
  },
  "packageEvidence": {
    "metadata": {
      "source": "operator-provided-iherb-screenshots",
      "capturedAt": "2026-07-02T00:00:00.000Z"
    },
    "packageImages": [
      {
        "uri": "file:///tmp/codex-remote-attachments/019f13d4-dd9c-7922-970f-b2f618374896/8dedfeea-422e-4c94-a197-babce4360f41/1-Photo-1.jpg",
        "kind": "front-label"
      },
      {
        "uri": "file:///tmp/codex-remote-attachments/019f13d4-dd9c-7922-970f-b2f618374896/8dedfeea-422e-4c94-a197-babce4360f41/2-Photo-2.jpg",
        "kind": "supplement-facts"
      }
    ],
    "labelSources": [
      {
        "sourceId": "operator-image:jarrow-b-right-supplement-facts",
        "labelText": "Supplement Facts. Serving Size 1 Capsule. Thiamin (as Thiamine Mononitrate) 25 mg; Riboflavin 25 mg; Niacin (as Niacinamide) 25 mg NE; Vitamin B6 (Pyridoxine HCl 25 mg and Pyridoxal 5-Phosphate 10 mg) 35 mg; Folate 680 mcg DFE / 400 mcg as (6S)-5-Methyltetrahydrofolate; Vitamin B12 (as Methylcobalamin) 100 mcg; Biotin (as d-Biotin) 300 mcg; Pantothenic Acid (as Calcium D-Pantothenate) 100 mg; Choline (as Choline Bitartrate) 50 mg; Pantethine 25 mg; Inositol 50 mg. Other Ingredients: Capsule (hydroxypropylmethylcellulose), microcrystalline cellulose, silicon dioxide, calcium phosphate, magnesium stearate (vegetable source) and stearic acid (vegetable source)."
      }
    ]
  },
  "supplementLabel": {
    "servingSize": "1 capsule",
    "netContent": "100 veggie capsules",
    "dosageForm": "veggie capsule",
    "activeNutrients": {
      "vitaminB1ThiaminMg": 25,
      "vitaminB2RiboflavinMg": 25,
      "vitaminB3NiacinMgNE": 25,
      "vitaminB6Mg": 35,
      "folateMcgDFE": 680,
      "folate5MthfMcg": 400,
      "vitaminB12MethylcobalaminMcg": 100,
      "biotinMcg": 300,
      "pantothenicAcidMg": 100,
      "cholineMg": 50,
      "pantethineMg": 25,
      "inositolMg": 50
    },
    "otherIngredients": [
      "hydroxypropylmethylcellulose capsule",
      "microcrystalline cellulose",
      "silicon dioxide",
      "calcium phosphate",
      "magnesium stearate (vegetable source)",
      "stearic acid (vegetable source)"
    ],
    "notes": "B6 label line states 25 mg pyridoxine HCl plus 10 mg pyridoxal 5-phosphate, total 35 mg. Folate line states 680 mcg DFE with 400 mcg as 6S-5-MTHF. Values transcribed from provided image; no concentration was inferred beyond visible label text."
  },
  "dbAlignmentReport": {
    "id": "5543a5b1ca65",
    "status": "passing"
  },
  "operatorConfirmation": {
    "localWriteApproved": true,
    "productionPackageApproved": true
  }
}
